{
  "$schema": "https://json-schema.org/draft/2020-12/schema",
  "$id": "https://twin.example/spec/0.1/import.schema.json",
  "title": "import",
  "$comment": "SOURCE pp. 6–7,30,35–36. APPROVED D-009: commit freezes dataset and queues inference proposal, never mutates canonical Twin before human approval. APPROVED D-043 (T-016): profile is null until profiling completes; preview holds the first rows' raw values keyed by source column name. T-017 (D-043 (c) APPROVED; D-070, D-071, D-072 PROPOSED): mapping is the mapping a person confirmed (import-mapping.schema.json); saving one makes the next mapping_revision and the import VALIDATING until the import_validate job of that revision has read every row: VALIDATED when every row maps to a valid canonical event, AWAITING_MAPPING with validation.valid false, invalid_rows and an error report otherwise; validation, invalid_rows, canonical_preview and the error report always describe the current mapping_revision.",
  "type": "object",
  "properties": {
    "id": {
      "$ref": "common.schema.json#/$defs/ImportID"
    },
    "organization_id": {
      "$ref": "common.schema.json#/$defs/OrganizationID"
    },
    "project_id": {
      "$ref": "common.schema.json#/$defs/ProjectID"
    },
    "model_id": {
      "$ref": "common.schema.json#/$defs/ModelID"
    },
    "base_version_id": {
      "$ref": "common.schema.json#/$defs/ModelVersionID"
    },
    "kind": {
      "type": "string",
      "enum": [
        "csv_events",
        "json_events",
        "json_model"
      ]
    },
    "filename": {
      "type": "string",
      "minLength": 1,
      "maxLength": 255
    },
    "status": {
      "type": "string",
      "enum": [
        "UPLOADED",
        "PROFILING",
        "AWAITING_MAPPING",
        "VALIDATING",
        "VALIDATED",
        "COMMITTED",
        "FAILED"
      ],
      "description": "UPLOADED, PROFILING (the import_profile job), AWAITING_MAPPING (profiled, or validated with invalid rows), VALIDATING (the import_validate job of mapping_revision is reading every row), VALIDATED (every row is valid under the current mapping; the canonical dataset is stored for commit), COMMITTED (T-018) or FAILED (final)."
    },
    "mapping_revision": {
      "type": "integer",
      "minimum": 0,
      "maximum": 9007199254740991,
      "description": "How many mappings a person has saved: 0 before the first (D-071). Each saveImportMapping names the revision it expects and makes the next; validation results are only ever those of the current revision."
    },
    "total_rows": {
      "type": "integer",
      "minimum": 0,
      "maximum": 100000
    },
    "invalid_rows": {
      "type": "integer",
      "minimum": 0,
      "maximum": 100000,
      "description": "Rows that are not valid: after profiling, CSV rows whose field count differs from the header's; after validation, the rows that do not map to a valid canonical event under the current mapping (D-072). 0 while VALIDATING."
    },
    "profile": {
      "anyOf": [
        {
          "$ref": "#/$defs/Profile"
        },
        {
          "type": "null"
        }
      ]
    },
    "preview": {
      "type": "array",
      "items": {
        "type": "object",
        "maxProperties": 256,
        "additionalProperties": true,
        "description": "UNTRUSTED_DATA (D-043): one source row's raw values keyed by source column name (member order is not significant: profile.columns gives the column order), the first rows of the file in order; CSV values are always strings, JSON event values are the raw JSON values. The server cuts string values (at any depth) longer than 256 characters to 255 characters and a final U+2026, and bounds the whole preview to 1 MiB, so it may hold fewer than 100 rows. A CSV row with too few fields lacks the missing columns; fields beyond the header are left out (the error report lists the row)."
      },
      "minItems": 0,
      "maxItems": 100
    },
    "canonical_preview": {
      "type": "array",
      "items": {
        "anyOf": [
          {
            "$ref": "canonical-event.schema.json"
          },
          {
            "type": "null"
          }
        ]
      },
      "minItems": 0,
      "maxItems": 100,
      "description": "UNTRUSTED_DATA (D-043 (b), D-072): the canonical events of the preview's rows under the current mapping, one per preview row in order (null for a row that is not valid), written with the validation; empty before it is done. Metadata strings are cut like the preview's (at most 256 characters), and the whole is bounded to 1 MiB, so it may hold fewer rows than the preview."
    },
    "mapping": {
      "anyOf": [
        {
          "$ref": "import-mapping.schema.json"
        },
        {
          "type": "null"
        }
      ],
      "description": "The mapping of the current mapping_revision, as a person confirmed it (D-043 (c)); null before the first save."
    },
    "validation": {
      "anyOf": [
        {
          "$ref": "common.schema.json#/$defs/Validation"
        },
        {
          "type": "null"
        }
      ],
      "description": "The validation of the current mapping_revision (D-072), null before it is done: valid, and up to 100 issues, each with a typed code, a fixed message that never quotes the file, and a JSON Pointer into the file seen as an array of rows (/<row>/<source column>, or /<row> for the whole row, \"\" for the dataset). Every invalid row is in the error report."
    },
    "dataset_version_id": {
      "anyOf": [
        {
          "$ref": "common.schema.json#/$defs/DatasetVersionID"
        },
        {
          "type": "null"
        }
      ]
    },
    "proposal_id": {
      "anyOf": [
        {
          "$ref": "common.schema.json#/$defs/ProposalID"
        },
        {
          "type": "null"
        }
      ]
    },
    "created_at": {
      "type": "string",
      "format": "date-time"
    },
    "error": {
      "anyOf": [
        {
          "$ref": "common.schema.json#/$defs/Error"
        },
        {
          "type": "null"
        }
      ]
    },
    "mapping_suggestion_status": {
      "type": "string",
      "enum": [
        "none",
        "generating",
        "ready",
        "failed"
      ]
    },
    "mapping_suggestion": {
      "anyOf": [
        {
          "$ref": "ai-mapping.schema.json"
        },
        {
          "type": "null"
        }
      ]
    }
  },
  "required": [
    "id",
    "organization_id",
    "project_id",
    "model_id",
    "base_version_id",
    "kind",
    "filename",
    "status",
    "mapping_revision",
    "total_rows",
    "invalid_rows",
    "profile",
    "preview",
    "canonical_preview",
    "mapping",
    "validation",
    "dataset_version_id",
    "proposal_id",
    "created_at",
    "error",
    "mapping_suggestion_status",
    "mapping_suggestion"
  ],
  "additionalProperties": false,
  "$defs": {
    "Profile": {
      "type": "object",
      "description": "D-043(a): the profile of the whole uploaded file, computed by the import_profile job. rows counts data rows (CSV records after the header, JSON events array elements; 0 for json_model). columns lists the source columns in file order: the CSV header, or the top-level member names of the JSON events in order of first appearance; empty for json_model.",
      "properties": {
        "format": {
          "type": "string",
          "enum": [
            "csv",
            "json_events",
            "json_model"
          ]
        },
        "encoding": {
          "type": "string",
          "enum": [
            "utf-8",
            "utf-8-bom"
          ]
        },
        "rows": {
          "type": "integer",
          "minimum": 0,
          "maximum": 100000
        },
        "columns": {
          "type": "array",
          "items": {
            "$ref": "#/$defs/ProfileColumn"
          },
          "minItems": 0,
          "maxItems": 256
        }
      },
      "required": [
        "format",
        "encoding",
        "rows",
        "columns"
      ],
      "additionalProperties": false,
      "if": {
        "properties": {
          "format": {
            "const": "json_model"
          }
        },
        "required": [
          "format"
        ]
      },
      "then": {
        "properties": {
          "rows": {
            "const": 0
          },
          "columns": {
            "maxItems": 0
          }
        }
      }
    },
    "ProfileColumn": {
      "type": "object",
      "description": "One source column (D-043(a)). inferred is the one type all non-empty values share (integer and number together are number), empty when no value is non-empty, else mixed; JSON objects and arrays count as mixed. non_empty counts values that are present, not null and not the empty string; max_length is the longest value in characters (Unicode code points).",
      "properties": {
        "name": {
          "type": "string",
          "minLength": 1,
          "maxLength": 256
        },
        "index": {
          "type": "integer",
          "minimum": 0,
          "maximum": 255
        },
        "inferred": {
          "type": "string",
          "enum": [
            "empty",
            "boolean",
            "integer",
            "number",
            "timestamp",
            "string",
            "mixed"
          ]
        },
        "non_empty": {
          "type": "integer",
          "minimum": 0,
          "maximum": 100000
        },
        "max_length": {
          "type": "integer",
          "minimum": 0,
          "maximum": 32768
        }
      },
      "required": [
        "name",
        "index",
        "inferred",
        "non_empty",
        "max_length"
      ],
      "additionalProperties": false
    }
  },
  "allOf": [
    {
      "if": {
        "properties": {
          "status": {
            "const": "VALIDATING"
          }
        },
        "required": [
          "status"
        ]
      },
      "then": {
        "properties": {
          "mapping": {
            "type": "object"
          },
          "validation": {
            "type": "null"
          },
          "invalid_rows": {
            "const": 0
          },
          "canonical_preview": {
            "maxItems": 0
          }
        }
      }
    },
    {
      "if": {
        "properties": {
          "status": {
            "const": "VALIDATED"
          }
        },
        "required": [
          "status"
        ]
      },
      "then": {
        "properties": {
          "mapping": {
            "type": "object"
          },
          "invalid_rows": {
            "const": 0
          },
          "validation": {
            "type": "object",
            "properties": {
              "valid": {
                "const": true
              }
            },
            "required": [
              "valid"
            ]
          }
        }
      }
    }
  ]
}
