{
  "id": "imp_01M4YDQK0001HSSAXJ76PRHJ58",
  "organization_id": "org_01M4YDQK00Y5H2929M9WWZWTVH",
  "project_id": "prj_01M4YDQK00K9HVKK0GQKY0MHSA",
  "model_id": "mdl_01M4YDQK004AGVNEGJQJ1NMM0N",
  "base_version_id": "mv_01M4YDQK00FRYWV7GS7X1QCXZR",
  "kind": "csv_events",
  "filename": "synthetic-steps.csv",
  "status": "PROFILING",
  "mapping_revision": 0,
  "total_rows": 0,
  "invalid_rows": 0,
  "profile": null,
  "preview": [],
  "canonical_preview": [],
  "mapping": null,
  "validation": null,
  "dataset_version_id": null,
  "proposal_id": null,
  "created_at": "2026-10-15T08:30:00Z",
  "error": null,
  "mapping_suggestion_status": "none",
  "mapping_suggestion": null
}
